<?xml version="1.0" encoding="UTF-8" standalone="yes"?>
<xs:schema version="1.0" xmlns:xs="http://www.w3.org/2001/XMLSchema">

  <xs:element name="company" type="company"/>

  <xs:element name="employee" type="employee"/>

  <xs:complexType name="company">
    <xs:sequence>
      <xs:element name="departments" type="department" nillable="true" minOccurs="0" maxOccurs="unbounded"/>
    </xs:sequence>
    <xs:attribute name="name" type="xs:string"/>
  </xs:complexType>

  <xs:complexType name="department">
    <xs:sequence>
      <xs:element name="employees" type="employee" nillable="true" minOccurs="0" maxOccurs="unbounded"/>
    </xs:sequence>
    <xs:attribute name="name" type="xs:string"/>
  </xs:complexType>

  <xs:complexType name="employee">
    <xs:sequence/>
    <xs:attribute name="name" type="xs:string"/>
    <xs:attribute name="salary" type="xs:int" use="required"/>
  </xs:complexType>
</xs:schema>

