<?xml version="1.0" encoding="UTF-8" standalone="yes"?>
<company xmlns:xsi="http://www.w3.org/2001/XMLSchema-instance" name="ACME" xsi:noNamespaceSchemaLocation="./input/org/softlang/megal/acme/acme.xsd">
    <departments name="D0">
        <employees name="E0" salary="1000"/>
        <employees name="E1" salary="2000"/>
        <employees name="E2" salary="3000"/>
        <employees name="E3" salary="4000"/>
        <employees name="E4" salary="5000"/>
        <employees name="E5" salary="6000"/>
        <employees name="E6" salary="7000"/>
        <employees name="E7" salary="8000"/>
        <employees name="E8" salary="9000"/>
        <employees name="E9" salary="10000"/>
    </departments>
    <departments name="D1">
        <employees name="E0" salary="1000"/>
        <employees name="E1" salary="2000"/>
        <employees name="E2" salary="3000"/>
        <employees name="E3" salary="4000"/>
        <employees name="E4" salary="5000"/>
        <employees name="E5" salary="6000"/>
        <employees name="E6" salary="7000"/>
        <employees name="E7" salary="8000"/>
        <employees name="E8" salary="9000"/>
        <employees name="E9" salary="10000"/>
    </departments>
    <departments name="D2">
        <employees name="E0" salary="1000"/>
        <employees name="E1" salary="2000"/>
        <employees name="E2" salary="3000"/>
        <employees name="E3" salary="4000"/>
        <employees name="E4" salary="5000"/>
        <employees name="E5" salary="6000"/>
        <employees name="E6" salary="7000"/>
        <employees name="E7" salary="8000"/>
        <employees name="E8" salary="9000"/>
        <employees name="E9" salary="10000"/>
    </departments>
    <departments name="D3">
        <employees name="E0" salary="1000"/>
        <employees name="E1" salary="2000"/>
        <employees name="E2" salary="3000"/>
        <employees name="E3" salary="4000"/>
        <employees name="E4" salary="5000"/>
        <employees name="E5" salary="6000"/>
        <employees name="E6" salary="7000"/>
        <employees name="E7" salary="8000"/>
        <employees name="E8" salary="9000"/>
        <employees name="E9" salary="10000"/>
    </departments>
    <departments name="D4">
        <employees name="E0" salary="1000"/>
        <employees name="E1" salary="2000"/>
        <employees name="E2" salary="3000"/>
        <employees name="E3" salary="4000"/>
        <employees name="E4" salary="5000"/>
        <employees name="E5" salary="6000"/>
        <employees name="E6" salary="7000"/>
        <employees name="E7" salary="8000"/>
        <employees name="E8" salary="9000"/>
        <employees name="E9" salary="10000"/>
    </departments>
    <departments name="D5">
        <employees name="E0" salary="1000"/>
        <employees name="E1" salary="2000"/>
        <employees name="E2" salary="3000"/>
        <employees name="E3" salary="4000"/>
        <employees name="E4" salary="5000"/>
        <employees name="E5" salary="6000"/>
        <employees name="E6" salary="7000"/>
        <employees name="E7" salary="8000"/>
        <employees name="E8" salary="9000"/>
        <employees name="E9" salary="10000"/>
    </departments>
    <departments name="D6">
        <employees name="E0" salary="1000"/>
        <employees name="E1" salary="2000"/>
        <employees name="E2" salary="3000"/>
        <employees name="E3" salary="4000"/>
        <employees name="E4" salary="5000"/>
        <employees name="E5" salary="6000"/>
        <employees name="E6" salary="7000"/>
        <employees name="E7" salary="8000"/>
        <employees name="E8" salary="9000"/>
        <employees name="E9" salary="10000"/>
    </departments>
    <departments name="D7">
        <employees name="E0" salary="1000"/>
        <employees name="E1" salary="2000"/>
        <employees name="E2" salary="3000"/>
        <employees name="E3" salary="4000"/>
        <employees name="E4" salary="5000"/>
        <employees name="E5" salary="6000"/>
        <employees name="E6" salary="7000"/>
        <employees name="E7" salary="8000"/>
        <employees name="E8" salary="9000"/>
        <employees name="E9" salary="10000"/>
    </departments>
    <departments name="D8">
        <employees name="E0" salary="1000"/>
        <employees name="E1" salary="2000"/>
        <employees name="E2" salary="3000"/>
        <employees name="E3" salary="4000"/>
        <employees name="E4" salary="5000"/>
        <employees name="E5" salary="6000"/>
        <employees name="E6" salary="7000"/>
        <employees name="E7" salary="8000"/>
        <employees name="E8" salary="9000"/>
        <employees name="E9" salary="10000"/>
    </departments>
    <departments name="D9">
        <employees name="E0" salary="1000"/>
        <employees name="E1" salary="2000"/>
        <employees name="E2" salary="3000"/>
        <employees name="E3" salary="4000"/>
        <employees name="E4" salary="5000"/>
        <employees name="E5" salary="6000"/>
        <employees name="E6" salary="7000"/>
        <employees name="E7" salary="8000"/>
        <employees name="E8" salary="9000"/>
        <employees name="E9" salary="10000"/>
    </departments>
</company>
